{
  "id": "autonomous",
  "label": "Fully Autonomous",
  "description": "Self-operating platform with AI agent fleets, AI COO chatbot, cron orchestration, and Intelligence OS dashboard",
  "forced_depth_mode": "enterprise",
  "reference_doc": "AutonomousSystemBlueprint.md",
  "architecture_context": "This project follows the Autonomous System Blueprint: a 4-layer architecture (Directives, Orchestration, Execution, Verification) with AI agent fleets managed by a cron scheduler, an 8-step autonomous decision engine, an AI COO chatbot for executive command, a visitor-facing AI assistant with cross-session memory and RAG, department-based organizational structure with health scoring, meta-agent self-improvement loops, and a 24-tab Intelligence OS monitoring dashboard. Data is stored in 6 core models (AiAgent, Department, DepartmentEvent, Initiative, Ticket, IntelligenceDecision) using JSONB columns for flexible metadata. The orchestrator uses a generic runAgent() wrapper with trace IDs, rolling avg duration, and error isolation. Security operations include 8 specialized agents with director coordination and escalation chains.",
  "feature_seeds": [
    {"id": "agent_registry", "name": "Agent Registry & Seed System", "description": "Declarative agent definitions with idempotent DB seeding on startup", "category": "Architecture & Infrastructure"},
    {"id": "department_system", "name": "Department System", "description": "Organizational units with health scores, innovation scores, and KPIs", "category": "Architecture & Infrastructure"},
    {"id": "orchestrator_engine", "name": "Orchestrator Engine", "description": "Generic runAgent() wrapper with trace IDs, metrics, and error isolation", "category": "Architecture & Infrastructure"},
    {"id": "cron_scheduler", "name": "Cron Scheduler", "description": "Schedule registry with DB overrides and staggered execution", "category": "Architecture & Infrastructure"},
    {"id": "autonomous_decision_engine", "name": "Autonomous Decision Engine", "description": "8-step pipeline: discover, analyze, plan, estimate, evaluate, execute, learn, ticket", "category": "AI & Intelligence"},
    {"id": "ai_coo_chatbot", "name": "AI COO Chatbot", "description": "Natural-language command interface for fleet management with intent classification", "category": "AI & Intelligence"},
    {"id": "visitor_ai_assistant", "name": "Visitor AI Assistant", "description": "Conversational AI with cross-session memory, RAG knowledge, and function calling", "category": "AI & Intelligence"},
    {"id": "meta_agent_loop", "name": "Meta-Agent Self-Improvement Loop", "description": "Performance analysis, architecture review, prompt optimization, experiment management", "category": "AI & Intelligence"},
    {"id": "strategy_architects", "name": "Department Strategy Architects", "description": "Per-department agents evaluating health, opportunities, and strategic initiatives", "category": "AI & Intelligence"},
    {"id": "security_ops_fleet", "name": "Security Operations Fleet", "description": "8 agents: secret detection, code audit, dependency scan, runtime threats, AI safety", "category": "Security & Compliance"},
    {"id": "self_healing_agents", "name": "Self-Healing Agents", "description": "Automated repair for stuck agents, broken links, campaign QA, orchestration health", "category": "Observability & Monitoring"},
    {"id": "intelligence_os_dashboard", "name": "Intelligence OS Dashboard", "description": "24-tab monitoring system with drilldown modals grouped into 5 categories", "category": "Analytics & Reporting"},
    {"id": "agent_activity_logging", "name": "Agent Activity Logging", "description": "Structured execution records with trace IDs, duration, and context", "category": "Observability & Monitoring"},
    {"id": "department_event_system", "name": "Department Event System", "description": "Event and alert model with severity levels and JSONB metadata", "category": "Core Functionality"},
    {"id": "initiative_tracking", "name": "Initiative Tracking", "description": "Strategic work items with progress, risk level, and cross-department support", "category": "Core Functionality"},
    {"id": "ticket_system", "name": "Ticket System", "description": "Agent-created actionable tasks with source tracking and confidence scores", "category": "Core Functionality"},
    {"id": "governance_engine", "name": "Governance & Safety Engine", "description": "Confidence scoring, escalation protocol, approval boundaries, stall detection", "category": "Security & Compliance"},
    {"id": "cross_session_memory", "name": "Cross-Session Memory", "description": "Visitor memory persistence with conversation summaries and interest detection", "category": "AI & Intelligence"},
    {"id": "rag_knowledge_system", "name": "RAG Knowledge System", "description": "Keyword-scored retrieval from seeded knowledge base entries", "category": "AI & Intelligence"},
    {"id": "executive_briefing_system", "name": "Executive Briefing System", "description": "Strategic intelligence cycle with revenue, cost, growth, and governance agents", "category": "Analytics & Reporting"},
    {"id": "db_schedule_overrides", "name": "DB-Driven Schedule Overrides", "description": "Runtime cron schedule changes without redeployment", "category": "DevOps & Deployment"},
    {"id": "agent_behavior_monitor", "name": "Agent Behavior Monitor", "description": "Detect stuck agents, error spikes, and duration anomalies", "category": "Observability & Monitoring"},
    {"id": "atomic_task_checkout", "name": "Atomic Task Checkout", "description": "Prevents two agents from working on the same task via DB-level locking", "category": "Architecture & Infrastructure"},
    {"id": "budget_enforcement", "name": "Per-Agent Budget Enforcement", "description": "Monthly budgets with soft warnings and hard auto-pause at limits", "category": "Security & Compliance"}
  ],
  "outline_context": "This project MUST follow the Autonomous System Blueprint architecture:\n\n1. **4-Layer Model**: Directives (SOPs) → Orchestration (AI COO + Decision Engine) → Execution (Deterministic agent executors) → Verification (Tests)\n2. **Agent Fleet**: 100+ agents across departments, each with registry entry, executor, runner wrapper, and cron schedule\n3. **Department System**: Organizational units with health/innovation scoring, strategy architects, and KPI tracking\n4. **Orchestrator**: Generic runAgent() with trace IDs, rolling avg duration, error isolation, pause support\n5. **Cron Scheduler**: Schedule registry with DB overrides, staggered execution, frequency tiers (1min to daily)\n6. **Autonomous Decision Engine**: 8-step pipeline (discover → analyze → plan → estimate → evaluate → execute → learn → ticket) with auto-execution for low-risk/high-confidence changes\n7. **AI COO Chatbot**: Intent classification → context assembly → agent dispatch → response formatting\n8. **Visitor AI Assistant**: 7-component system prompt, cross-session memory, RAG knowledge, function calling, follow-up suggestions\n9. **Security Operations**: 8 specialized agents with director coordination and escalation chains\n10. **Self-Healing**: Automated repair at multiple frequency tiers\n11. **Intelligence OS Dashboard**: 24 tabs in 5 groups (Overview, Agent Fleet, Operations, Strategy, Analytics)\n12. **Data Model**: 6 core tables (AiAgent, Department, DepartmentEvent, Initiative, Ticket, IntelligenceDecision) with JSONB columns\n13. **Governance**: Confidence scoring (>0.80 proceed, 0.65-0.80 proceed+log, <0.65 diagnostic), escalation protocol, approval boundaries\n14. **Meta-Agent Loop**: Hourly self-improvement (performance, architecture, prompts, experiments)",
  "chapter_context": "IMPORTANT: This project uses the Autonomous System Blueprint architecture.\n\nKey patterns to reference in implementation guidance:\n- Agents are defined declaratively in a registry array and seeded idempotently via findOrCreate\n- The orchestrator wraps every agent execution with: enabled/paused check → trace ID → execute → rolling avg metrics → activity logging → error isolation\n- Cron schedules use staggered offsets to avoid thundering herd (e.g., 2-minute offsets for same-category agents)\n- The autonomous decision engine auto-executes when risk_score < 40 AND confidence > 70%, otherwise creates tickets for human review\n- All agent output is stored in JSONB columns on existing tables (no new tables per agent type)\n- Department health scores (0-100) are computed by strategy architect agents every 6 hours\n- The AI COO uses two-phase intent classification: fast-path keyword matching, then LLM fallback\n- The visitor AI assistant composes system prompts from 7 components (persona, page context, memory, knowledge, overlays, constraints, format rules)\n- Security operations follow an escalation chain: agent scan → DepartmentEvent → SecurityDirector review → Ticket → Initiative\n- Frontend uses Promise.allSettled for resilient data loading (one failed API never blanks an entire tab)\n- Every entity name in dashboard tables is clickable → opens Bootstrap modal with full details"
}
